{
  "schema_version": "1.0.0",
  "generated_at": "2026-08-19T00:00:00+03:00",
  "publications": [],
  "themes": [],
  "theme_publication_relationships": [],
  "projects_and_systems": [],
  "courses": [],
  "teaching_occurrences": [],
  "career": [],
  "service": [],
  "metrics": [],
  "profile_links": [],
  "availability_states": []
}
